68,Дані про видані дозволи на порушення об’єктів благоустрою,Управління контролю за станом благоустрою,https://opendata.kremen.gov.ua/dataset/%D0%B4%D0%B0%D0%BD%D1%96-%D0%BF%D1%80%D0%BE-%D0%B2%D0%B8%D0%B4%D0%B0%D0%BD%D1%96-%D0%B4%D0%BE%D0%B7%D0%B2%D0%BE%D0%BB%D0%B8-%D0%BD%D0%B0-%D0%BF%D0%BE%D1%80%D1%83%D1%88%D0%B5%D0%BD%D0%BD%D1%8F-%D0%BE%D0%B1%E2%80%99%D1%94%D0%BA%D1%82%D1%96%D0%B2-%D0%B1%D0%BB%D0%B0%D0%B3%D0%BE%D1%83%D1%81%D1%82%D1%80%D0%BE%D1%8E,https://data.gov.ua/dataset/3d2d5570-d7e9-4a49-b6d2-3af6e3e9fc1c
69,Черга на отримання земельних ділянок із земель комунальної власності,Управління земельних ресурсів,https://opendata.kremen.gov.ua/dataset/%D1%87%D0%B5%D1%80%D0%B3%D0%B0-%D0%BD%D0%B0-%D0%BE%D1%82%D1%80%D0%B8%D0%BC%D0%B0%D0%BD%D0%BD%D1%8F-%D0%B7%D0%B5%D0%BC%D0%B5%D0%BB%D1%8C%D0%BD%D0%B8%D1%85-%D0%B4%D1%96%D0%BB%D1%8F%D0%BD%D0%BE%D0%BA-%D1%96%D0%B7-%D0%B7%D0%B5%D0%BC%D0%B5%D0%BB%D1%8C-%D0%BA%D0%BE%D0%BC%D1%83%D0%BD%D0%B0%D0%BB%D1%8C%D0%BD%D0%BE%D1%97-%D0%B2%D0%BB%D0%B0%D1%81%D0%BD%D0%BE%D1%81%D1%82%D1%96,https://data.gov.ua/dataset/60cd32bf-af3c-4a56-9e68-dc245a4038d2
70,"Дані обліку громадян, які потребують поліпшення житлових умов (квартирний облік)",Квартирне управління,https://opendata.kremen.gov.ua/dataset/%D0%B4%D0%B0%D0%BD%D1%96-%D0%BE%D0%B1%D0%BB%D1%96%D0%BA%D1%83-%D0%B3%D1%80%D0%BE%D0%BC%D0%B0%D0%B4%D1%8F%D0%BD-%D1%8F%D0%BA%D1%96-%D0%BF%D0%BE%D1%82%D1%80%D0%B5%D0%B1%D1%83%D1%8E%D1%82%D1%8C-%D0%BF%D0%BE%D0%BB%D1%96%D0%BF%D1%88%D0%B5%D0%BD%D0%BD%D1%8F-%D0%B6%D0%B8%D1%82%D0%BB%D0%BE%D0%B2%D0%B8%D1%85-%D1%83%D0%BC%D0%BE%D0%B2-%D0%BA%D0%B2%D0%B0%D1%80%D1%82%D0%B8%D1%80%D0%BD%D0%B8%D0%B9-%D0%BE%D0%B1%D0%BB%D1%96%D0%BA,https://data.gov.ua/dataset/50666cbf-49dd-4c73-9e6e-2725074aa7a6
71,"Дані про споживання комунальних ресурсів (електроенергія, теплова енергія, природний газ, тверде паливо, холодна та гаряча вода) комунальними підприємствами, установами (закладами) та організаціями",Відділ енергоменеджменту та енергетики,https://opendata.kremen.gov.ua/dataset/%D0%B4%D0%B0%D0%BD%D1%96-%D0%BF%D1%80%D0%BE-%D1%81%D0%BF%D0%BE%D0%B6%D0%B8%D0%B2%D0%B0%D0%BD%D0%BD%D1%8F-%D0%BA%D0%BE%D0%BC%D1%83%D0%BD%D0%B0%D0%BB%D1%8C%D0%BD%D0%B8%D1%85-%D1%80%D0%B5%D1%81%D1%83%D1%80%D1%81%D1%96%D0%B2-%D0%B5%D0%BB%D0%B5%D0%BA%D1%82%D1%80%D0%BE%D0%B5%D0%BD%D0%B5%D1%80%D0%B3%D1%96%D1%8F-%D1%82%D0%B5%D0%BF%D0%BB%D0%BE%D0%B2%D0%B0-%D0%B5%D0%BD%D0%B5%D1%80%D0%B3%D1%96%D1%8F-%D0%BF%D1%80%D0%B8%D1%80%D0%BE%D0%B4%D0%BD%D0%B8%D0%B9-%D0%B3%D0%B0%D0%B7-1,https://data.gov.ua/dataset/d8e83530-b7a4-45bb-9000-d440321f1a8c
72,Надходження і використання благодійної допомоги,Охорона здоров'я,https://opendata.kremen.gov.ua/dataset/%D0%BD%D0%B0%D0%B4%D1%85%D0%BE%D0%B4%D0%B6%D0%B5%D0%BD%D0%BD%D1%8F-%D0%B9-%D0%B2%D0%B8%D0%BA%D0%BE%D1%80%D0%B8%D1%81%D1%82%D0%B0%D0%BD%D0%BD%D1%8F-%D0%B1%D0%BB%D0%B0%D0%B3%D0%BE%D0%B4%D1%96%D0%B9%D0%BD%D0%BE%D1%97-%D0%B4%D0%BE%D0%BF%D0%BE%D0%BC%D0%BE%D0%B3%D0%B8,https://data.gov.ua/dataset/8f5011ac-83b0-4a3b-9a9a-3cf3cee01264
73,Дані про надані містобудівні умови та обмеження,Управління містобудування та архітектури,https://opendata.kremen.gov.ua/dataset/%D0%B4%D0%B0%D0%BD%D1%96-%D0%BF%D1%80%D0%BE-%D0%BD%D0%B0%D0%B4%D0%B0%D0%BD%D1%96-%D0%BC%D1%96%D1%81%D1%82%D0%BE%D0%B1%D1%83%D0%B4%D1%96%D0%B2%D0%BD%D1%96-%D1%83%D0%BC%D0%BE%D0%B2%D0%B8-%D1%82%D0%B0-%D0%BE%D0%B1%D0%BC%D0%B5%D0%B6%D0%B5%D0%BD%D0%BD%D1%8F,https://data.gov.ua/dataset/104ce634-df58-4731-99a7-58269b1d05d3
74,"Планові та фактичні показники сплати за договорами оренди комунальної власності, розміщення тимчасових споруд, розміщення рекламних засобів",Управління містобудування та архітектури,https://opendata.kremen.gov.ua/dataset/%D0%BF%D0%BB%D0%B0%D0%BD%D0%BE%D0%B2%D1%96-%D1%82%D0%B0-%D1%84%D0%B0%D0%BA%D1%82%D0%B8%D1%87%D0%BD%D1%96-%D0%BF%D0%BE%D0%BA%D0%B0%D0%B7%D0%BD%D0%B8%D0%BA%D0%B8-%D1%81%D0%BF%D0%BB%D0%B0%D1%82%D0%B8-%D0%B7%D0%B0-%D0%B4%D0%BE%D0%B3%D0%BE%D0%B2%D0%BE%D1%80%D0%B0%D0%BC%D0%B8-%D0%BE%D1%80%D0%B5%D0%BD%D0%B4%D0%B8-%D0%BA%D0%BE%D0%BC%D1%83%D0%BD%D0%B0%D0%BB%D1%8C%D0%BD%D0%BE%D1%97-%D0%B2%D0%BB%D0%B0%D1%81%D0%BD%D0%BE%D1%81%D1%82%D1%96-%D1%80%D0%BE%D0%B7%D0%BC%D1%96%D1%89%D0%B5%D0%BD%D0%BD%D1%8F,https://data.gov.ua/dataset/4fe8361d-2821-4649-ac72-cd44d3203e27
75,"Дані про здійснення державного архітектурно-будівельного контролю, у тому числі про плани перевірок та складені документи (акти, приписи, протоколи, постанови)",Управління державного архітектурно-будівельного контролю,https://opendata.kremen.gov.ua/dataset/%D0%B4%D0%B0%D0%BD%D1%96-%D0%BF%D1%80%D0%BE-%D0%B7%D0%B4%D1%96%D0%B9%D1%81%D0%BD%D0%B5%D0%BD%D0%BD%D1%8F-%D0%B4%D0%B5%D1%80%D0%B6%D0%B0%D0%B2%D0%BD%D0%BE%D0%B3%D0%BE-%D0%B0%D1%80%D1%85%D1%96%D1%82%D0%B5%D0%BA%D1%82%D1%83%D1%80%D0%BD%D0%BE-%D0%B1%D1%83%D0%B4%D1%96%D0%B2%D0%B5%D0%BB%D1%8C%D0%BD%D0%BE%D0%B3%D0%BE-%D0%BA%D0%BE%D0%BD%D1%82%D1%80%D0%BE%D0%BB%D1%8E-%D1%83-%D1%82%D0%BE%D0%BC%D1%83-%D1%87%D0%B8%D1%81%D0%BB%D1%96-%D0%BF%D1%80%D0%BE-%D0%BF%D0%BB%D0%B0%D0%BD%D0%B8,https://data.gov.ua/dataset/29d9cc29-75ae-4c20-95c5-af0a7abc3f70
76,"Перелік та місцезнаходження закладів комунальних закладів охорони здоров’я, які забезпечені обладнанням гінекологічним, мамологічним обладнанням, що пристосоване до потреб осіб з інвалідністю з урахуванням особливостей їх пересування",Управління охорони здоров’я,https://opendata.kremen.gov.ua/dataset/%D0%BF%D0%B5%D1%80%D0%B5%D0%BB%D1%96%D0%BA-%D1%82%D0%B0-%D0%BC%D1%96%D1%81%D1%86%D0%B5%D0%B7%D0%BD%D0%B0%D1%85%D0%BE%D0%B4%D0%B6%D0%B5%D0%BD%D0%BD%D1%8F-%D0%BA%D0%BE%D0%BC%D1%83%D0%BD%D0%B0%D0%BB%D1%8C%D0%BD%D0%B8%D1%85-%D0%B7%D0%B0%D0%BA%D0%BB%D0%B0%D0%B4%D1%96%D0%B2-%D0%BE%D1%85%D0%BE%D1%80%D0%BE%D0%BD%D0%B8-%D0%B7%D0%B4%D0%BE%D1%80%D0%BE%D0%B2%D1%8F-%D1%8F%D0%BA%D1%96-%D0%B7%D0%B0%D0%B1%D0%B5%D0%B7%D0%BF%D0%B5%D1%87%D0%B5%D0%BD%D1%96,https://data.gov.ua/dataset/806f3c12-d7c5-4f8f-a341-e01573e84937
