№ з/п,"Набори даних, які підлягають оприлюдненню у формі відкритих даних",Розпорядник інформації,посилання на opedata.kremen.gov.ua,посилання на data.gov.ua
1,"Довідник підприємств, установ (закладів) та організацій розпорядника інформації та підпорядкованих йому організацій, у тому числі їх ідентифікаційних кодів, офіційних веб-сайтів, адрес електронної пошти, телефонів та адрес",Управління міського майна,https://opendata.kremen.gov.ua/dataset/%D0%B4%D0%BE%D0%B2%D1%96%D0%B4%D0%BD%D0%B8%D0%BA-%D0%BF%D1%96%D0%B4%D0%BF%D1%80%D0%B8%D1%94%D0%BC%D1%81%D1%82%D0%B2-%D1%83%D1%81%D1%82%D0%B0%D0%BD%D0%BE%D0%B2-%D0%B7%D0%B0%D0%BA%D0%BB%D0%B0%D0%B4%D1%96%D0%B2-%D1%82%D0%B0-%D0%BE%D1%80%D0%B3%D0%B0%D0%BD%D1%96%D0%B7%D0%B0%D1%86%D1%96%D0%B9-%D0%B7%D0%B0%D1%81%D0%BD%D0%BE%D0%B2%D0%BD%D0%B8%D0%BA%D0%BE%D0%BC-%D1%8F%D0%BA%D0%B8%D1%85-%D1%94-%D0%BA%D1%80%D0%B5%D0%BC%D0%B5%D0%BD%D1%87%D1%83%D1%86%D1%8C%D0%BA%D0%B0-%D0%BC%D1%96%D1%81%D1%8C%D0%BA%D0%B0,https://data.gov.ua/dataset/2b25eeef-e990-4fa4-9f64-dda291023695
2,Інформація про організаційну структуру розпорядника інформації,Відділ інформаційно-комп'ютерних технологій,https://opendata.kremen.gov.ua/dataset/%D1%96%D0%BD%D1%84%D0%BE%D1%80%D0%BC%D0%B0%D1%86%D1%96%D1%8F-%D0%BF%D1%80%D0%BE-%D0%BE%D1%80%D0%B3%D0%B0%D0%BD%D1%96%D0%B7%D0%B0%D1%86%D1%96%D0%B9%D0%BD%D1%83-%D1%81%D1%82%D1%80%D1%83%D0%BA%D1%82%D1%83%D1%80%D1%83-%D0%B2%D0%B8%D0%BA%D0%BE%D0%BD%D0%B0%D0%B2%D1%87%D0%BE%D0%B3%D0%BE-%D0%BA%D0%BE%D0%BC%D1%96%D1%82%D0%B5%D1%82%D1%83,https://data.gov.ua/dataset/bd4a3394-c6cf-46e4-8f48-75e7479e0fe3 
3,"Нормативи, що затверджуються та підлягають оприлюдненню відповідно до закону розпорядником інформації",Департамент житлово-комунального господарства,https://opendata.kremen.gov.ua/dataset/%D0%BD%D0%BE%D1%80%D0%BC%D0%B0%D1%82%D0%B8%D0%B2%D0%B8-%D1%89%D0%BE-%D0%B7%D0%B0%D1%82%D0%B2%D0%B5%D1%80%D0%B4%D0%B6%D1%83%D1%8E%D1%82%D1%8C%D1%81%D1%8F-%D1%82%D0%B0-%D0%BF%D1%96%D0%B4%D0%BB%D1%8F%D0%B3%D0%B0%D1%8E%D1%82%D1%8C-%D0%BE%D0%BF%D1%80%D0%B8%D0%BB%D1%8E%D0%B4%D0%BD%D0%B5%D0%BD%D0%BD%D1%8E-%D0%B2%D1%96%D0%B4%D0%BF%D0%BE%D0%B2%D1%96%D0%B4%D0%BD%D0%BE-%D0%B4%D0%BE-%D0%B7%D0%B0%D0%BA%D0%BE%D0%BD%D1%83-%D1%80%D0%BE%D0%B7%D0%BF%D0%BE%D1%80%D1%8F%D0%B4%D0%BD%D0%B8%D0%BA%D0%BE%D0%BC-91,https://data.gov.ua/dataset/df8f1eda-c3e4-46e1-939c-6fea9930424d
4,"Звіти, в тому числі щодо задоволення запитів на інформацію","Управління по роботі з документами, всі розпорядники",https://opendata.kremen.gov.ua/dataset/%D0%B7%D0%B2%D1%96%D1%82-%D0%BF%D1%80%D0%BE-%D1%80%D0%BE%D0%B7%D0%B3%D0%BB%D1%8F%D0%B4-%D0%B7%D0%B0%D0%BF%D0%B8%D1%82%D1%96%D0%B2-%D0%BD%D0%B0-%D0%B4%D0%BE%D1%81%D1%82%D1%83%D0%BF-%D0%B4%D0%BE-%D0%BF%D1%83%D0%B1%D0%BB%D1%96%D1%87%D0%BD%D0%BE%D1%97-%D1%96%D0%BD%D1%84%D0%BE%D1%80%D0%BC%D0%B0%D1%86%D1%96%D1%97-%D1%83-%D0%B2%D0%B8%D0%BA%D0%BE%D0%BD%D0%B0%D0%B2%D1%87%D0%BE%D0%BC%D1%83-%D0%BA%D0%BE%D0%BC%D1%96%D1%82%D0%B5%D1%82%D1%96-1,https://data.gov.ua/dataset/eaecaf14-1530-4f80-885c-086ef61a6601 
5,"Інформація про систему обліку, види інформації, яка зберігається розпорядником",Управління по роботі з документами,https://opendata.kremen.gov.ua/dataset/%D1%96%D0%BD%D1%84%D0%BE%D1%80%D0%BC%D0%B0%D1%86%D1%96%D1%8F-%D0%BF%D1%80%D0%BE-%D1%81%D0%B8%D1%81%D1%82%D0%B5%D0%BC%D1%83-%D0%BE%D0%B1%D0%BB%D1%96%D0%BA%D1%83-%D0%B2%D0%B8%D0%B4%D0%B8-%D1%96%D0%BD%D1%84%D0%BE%D1%80%D0%BC%D0%B0%D1%86%D1%96%D1%97-%D1%8F%D0%BA%D0%B0-%D0%B7%D0%B1%D0%B5%D1%80%D1%96%D0%B3%D0%B0%D1%94%D1%82%D1%8C%D1%81%D1%8F-%D1%80%D0%BE%D0%B7%D0%BF%D0%BE%D1%80%D1%8F%D0%B4%D0%BD%D0%B8%D0%BA%D0%BE%D0%BC-4 ,https://data.gov.ua/dataset/6c7c9598-d856-44ac-9fa0-08f98335bd81
6,"Реєстр наборів даних, що перебувають у володінні розпорядника інформації","Управління по роботі з документами, всі розпорядники",https://opendata.kremen.gov.ua/dataset/%D1%80%D0%B5%D1%94%D1%81%D1%82%D1%80-%D0%BD%D0%B0%D0%B1%D0%BE%D1%80%D1%96%D0%B2-%D0%B4%D0%B0%D0%BD%D0%B8%D1%85-%D1%89%D0%BE-%D0%BF%D0%B5%D1%80%D0%B5%D0%B1%D1%83%D0%B2%D0%B0%D1%8E%D1%82%D1%8C-%D1%83-%D0%B2%D0%BE%D0%BB%D0%BE%D0%B4%D1%96%D0%BD%D0%BD%D1%96-%D1%80%D0%BE%D0%B7%D0%BF%D0%BE%D1%80%D1%8F%D0%B4%D0%BD%D0%B8%D0%BA%D0%B0-%D1%96%D0%BD%D1%84%D0%BE%D1%80%D0%BC%D0%B0%D1%86%D1%96%D1%97,https://data.gov.ua/dataset/6f09a97d-625a-4a0b-a5b1-30251d90de80
7,"Адміністративні дані, що збираються (обробляються) та підлягають оприлюдненню відповідно до вимог закону, розпорядника інформації",Управління економіки,https://opendata.kremen.gov.ua/dataset/%D0%B0%D0%B4%D0%BC%D1%96%D0%BD%D1%96%D1%81%D1%82%D1%80%D0%B0%D1%82%D0%B8%D0%B2%D0%BD%D1%96-%D0%B4%D0%B0%D0%BD%D1%96-%D0%B2-%D0%B7%D0%BD%D0%B0%D1%87%D0%B5%D0%BD%D0%BD%D1%96-%D0%B7%D0%B0%D0%BA%D0%BE%D0%BD%D1%83-%D1%83%D0%BA%D1%80%D0%B0%D1%97%D0%BD%D0%B8-%D0%BF%D1%80%D0%BE-%D0%B4%D0%B5%D1%80%D0%B6%D0%B0%D0%B2%D0%BD%D1%83-%D1%81%D1%82%D0%B0%D1%82%D0%B8%D1%81%D1%82%D0%B8%D0%BA%D1%83-%D1%89%D0%BE-%D0%B7%D0%B1%D0%B8%D1%80%D0%B0%D1%8E%D1%82%D1%8C%D1%81%D1%8F,https://data.gov.ua/dataset/ab369b76-e8c0-402b-b6a3-0326dfd98e0b
8,"Нормативно-правові акти, акти індивідуальної дії (крім внутрішньоорганізаційних), прийняті розпорядником інформації, проекти рішень, що підлягають обговоренню, інформація, визначена законодавством про засади регуляторної політики",Управління по роботі з документами,https://opendata.kremen.gov.ua/dataset/%D0%BD%D0%BE%D1%80%D0%BC%D0%B0%D1%82%D0%B8%D0%B2%D0%BD%D0%BE-%D0%BF%D1%80%D0%B0%D0%B2%D0%BE%D0%B2%D1%96-%D0%B0%D0%BA%D1%82%D0%B8-%D0%B0%D0%BA%D1%82%D0%B8-%D1%96%D0%BD%D0%B4%D0%B8%D0%B2%D1%96%D0%B4%D1%83%D0%B0%D0%BB%D1%8C%D0%BD%D0%BE%D1%97-%D0%B4%D1%96%D1%97-%D0%BA%D1%80%D1%96%D0%BC-%D0%B2%D0%BD%D1%83%D1%82%D1%80%D1%96%D1%88%D0%BD%D1%8C%D0%BE%D0%BE%D1%80%D0%B3%D0%B0%D0%BD%D1%96%D0%B7%D0%B0%D1%86%D1%96%D0%B9%D0%BD%D0%B8%D1%85-%D0%BF%D1%80%D0%B8%D0%B9%D0%BD%D1%8F%D1%82%D1%96,https://data.gov.ua/dataset/be598218-561a-4d62-9011-7675c99c4d68
9,Інформація про нормативно-правові засади діяльності,Управління по роботі з документами/Управління забезпечення діяльності ради,https://opendata.kremen.gov.ua/dataset/%D1%96%D0%BD%D1%84%D0%BE%D1%80%D0%BC%D0%B0%D1%86%D1%96%D1%8F-%D0%BF%D1%80%D0%BE-%D0%BD%D0%BE%D1%80%D0%BC%D0%B0%D1%82%D0%B8%D0%B2%D0%BD%D0%BE-%D0%BF%D1%80%D0%B0%D0%B2%D0%BE%D0%B2%D1%96-%D0%B7%D0%B0%D1%81%D0%B0%D0%B4%D0%B8-%D0%B4%D1%96%D1%8F%D0%BB%D1%8C%D0%BD%D0%BE%D1%81%D1%82%D1%96-1,https://data.gov.ua/dataset/c87ef0ce-5841-4334-a9e7-a609c556363f
10,Фінансова звітність суб’єктів господарювання державного сектору економіки,"Управління бухгалтерського обліку та звітності, всі розпорядники",https://opendata.kremen.gov.ua/dataset/%D1%84%D1%96%D0%BD%D0%B0%D0%BD%D1%81%D0%BE%D0%B2%D0%B0-%D0%B7%D0%B2%D1%96%D1%82%D0%BD%D1%96%D1%81%D1%82%D1%8C-%D0%B2%D0%B8%D0%BA%D0%BE%D0%BD%D0%B0%D0%B2%D1%87%D0%BE%D0%B3%D0%BE-%D0%BA%D0%BE%D0%BC%D1%96%D1%82%D0%B5%D1%82%D1%83-%D0%BA%D1%80%D0%B5%D0%BC%D0%B5%D0%BD%D1%87%D1%83%D1%86%D1%8C%D0%BA%D0%BE%D1%97-%D0%BC%D1%96%D1%81%D1%8C%D0%BA%D0%BE%D1%97-%D1%80%D0%B0%D0%B4%D0%B8,https://data.gov.ua/dataset/01bf5828-1964-415c-b9dd-d505c576064d
11,"Переліки регуляторних актів із зазначенням дати набрання чинності, строку проведення базового, повторного та періодичного відстеження їх результативності та інформації про місце їх оприлюднення","Управління розвитку підприємництва, торгівлі, побуту та регуляторної політики",https://opendata.kremen.gov.ua/dataset/%D0%BF%D0%B5%D1%80%D0%B5%D0%BB%D1%96%D0%BA%D0%B8-%D1%80%D0%B5%D0%B3%D1%83%D0%BB%D1%8F%D1%82%D0%BE%D1%80%D0%BD%D0%B8%D1%85-%D0%B0%D0%BA%D1%82%D1%96%D0%B2-%D1%96%D0%B7-%D0%B7%D0%B0%D0%B7%D0%BD%D0%B0%D1%87%D0%B5%D0%BD%D0%BD%D1%8F%D0%BC-%D0%B4%D0%B0%D1%82%D0%B8-%D0%BD%D0%B0%D0%B1%D1%80%D0%B0%D0%BD%D0%BD%D1%8F-%D1%87%D0%B8%D0%BD%D0%BD%D0%BE%D1%81%D1%82%D1%96-%D1%81%D1%82%D1%80%D0%BE%D0%BA%D1%83-%D0%BF%D1%80%D0%BE%D0%B2%D0%B5%D0%B4%D0%B5%D0%BD%D0%BD%D1%8F-%D0%B1%D0%B0%D0%B7%D0%BE%D0%B2%D0%BE%D0%B3%D0%BE,https://data.gov.ua/dataset/0411dce4-72e0-4204-b0b0-0c93410d3e74
12,"План діяльності з підготовки проектів регуляторних актів із зазначенням видів і назв проектів, цілей їх прийняття, строків підготовки проектів, найменування органів і підрозділів, відповідальних за розроблення проектів регуляторних актів, дату їх внесення на розгляд регуляторного органу та посилання на місце оприлюднення","Управління розвитку підприємництва, торгівлі, побуту та регуляторної політики",https://opendata.kremen.gov.ua/dataset/%D0%BF%D0%BB%D0%B0%D0%BD-%D0%B4%D1%96%D1%8F%D0%BB%D1%8C%D0%BD%D0%BE%D1%81%D1%82%D1%96-%D0%B7-%D0%BF%D1%96%D0%B4%D0%B3%D0%BE%D1%82%D0%BE%D0%B2%D0%BA%D0%B8-%D0%BF%D1%80%D0%BE%D0%B5%D0%BA%D1%82%D1%96%D0%B2-%D1%80%D0%B5%D0%B3%D1%83%D0%BB%D1%8F%D1%82%D0%BE%D1%80%D0%BD%D0%B8%D1%85-%D0%B0%D0%BA%D1%82%D1%96%D0%B2-%D1%96%D0%B7-%D0%B7%D0%B0%D0%B7%D0%BD%D0%B0%D1%87%D0%B5%D0%BD%D0%BD%D1%8F%D0%BC-%D0%B2%D0%B8%D0%B4%D1%96%D0%B2-%D1%96-%D0%BD%D0%B0%D0%B7%D0%B2,https://data.gov.ua/dataset/874deb4f-5677-4d9c-882a-1969c704ae7b
13,"Інформація про отримане майно (обладнання, програмне забезпечення) у рамках міжнародної технічної допомоги",Управління охорони здоров'я,https://opendata.kremen.gov.ua/dataset/%D1%96%D0%BD%D1%84%D0%BE%D1%80%D0%BC%D0%B0%D1%86%D1%96%D1%8F-%D1%89%D0%BE%D0%B4%D0%BE-%D0%BE%D1%82%D1%80%D0%B8%D0%BC%D0%B0%D0%BD%D0%BE%D0%B3%D0%BE-%D0%BC%D0%B0%D0%B9%D0%BD%D0%B0-%D0%B2-%D1%80%D0%B0%D0%BC%D0%BA%D0%B0%D1%85-%D0%BC%D1%96%D0%B6%D0%BD%D0%B0%D1%80%D0%BE%D0%B4%D0%BD%D0%BE%D1%97-%D1%82%D0%B5%D1%85%D0%BD%D1%96%D1%87%D0%BD%D0%BE%D1%97-%D0%B4%D0%BE%D0%BF%D0%BE%D0%BC%D0%BE%D0%B3%D0%B8-0,https://data.gov.ua/dataset/02a9fc64-4e8f-40bc-914e-c611d1c24ec4
14,Основні положення генеральних планів населених пунктів та детальних планів територій,Управління містобудування та архітектури,https://opendata.kremen.gov.ua/dataset/%D0%BE%D1%81%D0%BD%D0%BE%D0%B2%D0%BD%D1%96-%D0%BF%D0%BE%D0%BB%D0%BE%D0%B6%D0%B5%D0%BD%D0%BD%D1%8F-%D0%B3%D0%B5%D0%BD%D0%B5%D1%80%D0%B0%D0%BB%D1%8C%D0%BD%D0%B8%D1%85-%D0%BF%D0%BB%D0%B0%D0%BD%D1%96%D0%B2-%D0%BD%D0%B0%D1%81%D0%B5%D0%BB%D0%B5%D0%BD%D0%B8%D1%85-%D0%BF%D1%83%D0%BD%D0%BA%D1%82%D1%96%D0%B2-%D1%82%D0%B0-%D0%B4%D0%B5%D1%82%D0%B0%D0%BB%D1%8C%D0%BD%D0%B8%D1%85-%D0%BF%D0%BB%D0%B0%D0%BD%D1%96%D0%B2-%D1%82%D0%B5%D1%80%D0%B8%D1%82%D0%BE%D1%80%D1%96%D1%97,https://data.gov.ua/dataset/25554868-7fb1-4305-907e-99029d336bf5
15,Перелік об’єктів комунальної власності,Управління міського майна,https://opendata.kremen.gov.ua/dataset/%D0%BF%D0%B5%D1%80%D0%B5%D0%BB%D1%96%D0%BA-%D0%BE%D0%B1%D1%94%D0%BA%D1%82%D1%96%D0%B2-%D0%BA%D0%BE%D0%BC%D1%83%D0%BD%D0%B0%D0%BB%D1%8C%D0%BD%D0%BE%D1%97-%D0%B2%D0%BB%D0%B0%D1%81%D0%BD%D0%BE%D1%81%D1%82%D1%96-0,https://data.gov.ua/dataset/31515f69-4492-4560-a10f-7b7122116912
16,"Перелік об’єктів комунальної власності, що передані в оренду чи інше право користування (з даними про умови передачі об’єктів в оренду)",Управління міського майна,https://opendata.kremen.gov.ua/dataset/%D0%BF%D0%B5%D1%80%D0%B5%D0%BB%D1%96%D0%BA-%D0%BE%D0%B1%D1%94%D0%BA%D1%82%D1%96%D0%B2-%D0%BA%D0%BE%D0%BC%D1%83%D0%BD%D0%B0%D0%BB%D1%8C%D0%BD%D0%BE%D1%97-%D0%B2%D0%BB%D0%B0%D1%81%D0%BD%D0%BE%D1%81%D1%82%D1%96-%D1%89%D0%BE-%D0%BF%D0%B5%D1%80%D0%B5%D0%B4%D0%B0%D0%BD%D1%96-%D0%B2-%D0%BE%D1%80%D0%B5%D0%BD%D0%B4%D1%83-%D1%87%D0%B8-%D1%96%D0%BD%D1%88%D0%B5-%D0%BF%D1%80%D0%B0%D0%B2%D0%BE-%D0%BA%D0%BE%D1%80%D0%B8%D1%81%D1%82%D1%83%D0%B2%D0%B0%D0%BD%D0%BD%D1%8F-%D0%B7,https://data.gov.ua/dataset/cf370f96-d6bd-449a-9d7d-b6bb950792b8
17,"Перелік об’єктів комунальної власності – земельних ділянок, що передані в оренду чи інше право користування ",Управління земельних ресурсів,https://opendata.kremen.gov.ua/dataset/%D0%BF%D0%B5%D1%80%D0%B5%D0%BB%D1%96%D0%BA-%D0%BE%D0%B1%E2%80%99%D1%94%D0%BA%D1%82%D1%96%D0%B2-%D0%BA%D0%BE%D0%BC%D1%83%D0%BD%D0%B0%D0%BB%D1%8C%D0%BD%D0%BE%D1%97-%D0%B2%D0%BB%D0%B0%D1%81%D0%BD%D0%BE%D1%81%D1%82%D1%96-%E2%80%93-%D0%B7%D0%B5%D0%BC%D0%B5%D0%BB%D1%8C%D0%BD%D0%B8%D1%85-%D0%B4%D1%96%D0%BB%D1%8F%D0%BD%D0%BE%D0%BA-%D1%89%D0%BE-%D0%BF%D0%B5%D1%80%D0%B5%D0%B4%D0%B0%D0%BD%D1%96-%D0%B2-%D0%BE%D1%80%D0%B5%D0%BD%D0%B4%D1%83-%D1%87%D0%B8-%D1%96%D0%BD%D1%88%D0%B5,https://data.gov.ua/dataset/12c53c9c-9b53-481b-bbe3-821fac0dcaa5 
18,"Перелік незадіяних земельних ділянок і майнових об’єктів (приміщень) комунальної форми власності, які можуть бути передані в користування",Управління міського майна Управління земельних ресурсів,https://opendata.kremen.gov.ua/dataset/%D0%BF%D0%B5%D1%80%D0%B5%D0%BB%D1%96%D0%BA-%D0%BD%D0%B5%D0%B7%D0%B0%D0%B4%D1%96%D1%8F%D0%BD%D0%B8%D1%85-%D0%BC%D0%B0%D0%B9%D0%BD%D0%BE%D0%B2%D0%B8%D1%85-%D0%BE%D0%B1%D1%94%D0%BA%D1%82%D1%96%D0%B2-%D0%BF%D1%80%D0%B8%D0%BC%D1%96%D1%89%D0%B5%D0%BD%D1%8C-%D0%BA%D0%BE%D0%BC%D1%83%D0%BD%D0%B0%D0%BB%D1%8C%D0%BD%D0%BE%D1%97-%D1%84%D0%BE%D1%80%D0%BC%D0%B8-%D0%B2%D0%BB%D0%B0%D1%81%D0%BD%D0%BE%D1%81%D1%82%D1%96-%D1%8F%D0%BA%D1%96-%D0%BC%D0%BE%D0%B6%D1%83%D1%82%D1%8C-%D0%B1%D1%83%D1%82%D0%B8,https://data.gov.ua/dataset/1b5b33aa-86f0-41c9-bfe3-5db71f7025c1 
19,Результати радіаційного контролю,"Комунальне підприємство ""Науковий центр еколого - соціальних досліджень""",https://opendata.kremen.gov.ua/dataset/%D1%80%D0%B5%D0%B7%D1%83%D0%BB%D1%8C%D1%82%D0%B0%D1%82%D0%B8-%D1%80%D0%B0%D0%B4%D1%96%D0%B0%D1%86%D1%96%D0%B9%D0%BD%D0%BE%D0%B3%D0%BE-%D0%BA%D0%BE%D0%BD%D1%82%D1%80%D0%BE%D0%BB%D1%8E,https://data.gov.ua/dataset/2c44a132-88b8-49e0-b05f-65a41f122bd0
20,"Інформація про використання публічних коштів під час будівництва, ремонту та реконструкції об’єктів дорожньої інфраструктури та хід виконання проектів",Департамент житлово-комунального господарства,https://opendata.kremen.gov.ua/dataset/%D1%96%D0%BD%D1%84%D0%BE%D1%80%D0%BC%D0%B0%D1%86%D1%96%D1%8F-%D0%BF%D1%80%D0%BE-%D0%B2%D0%B8%D0%BA%D0%BE%D1%80%D0%B8%D1%81%D1%82%D0%B0%D0%BD%D0%BD%D1%8F-%D0%BF%D1%83%D0%B1%D0%BB%D1%96%D1%87%D0%BD%D0%B8%D1%85-%D0%BA%D0%BE%D1%88%D1%82%D1%96%D0%B2-%D0%BF%D1%96%D0%B4-%D1%87%D0%B0%D1%81-%D0%B1%D1%83%D0%B4%D1%96%D0%B2%D0%BD%D0%B8%D1%86%D1%82%D0%B2%D0%B0-%D1%80%D0%B5%D0%BC%D0%BE%D0%BD%D1%82%D1%83-%D1%82%D0%B0-%D1%80%D0%B5%D0%BA%D0%BE%D0%BD%D1%81%D1%82%D1%80%D1%83%D0%BA%D1%86%D1%96%D1%97,https://data.gov.ua/dataset/0aacd6e2-dded-4419-a642-0996319a2279
21,"Генеральні плани населених пунктів, історико-архітектурні опорні плани, плани зонування територій та детальні плани територій (за винятком відомостей, які відповідно до законодавства становлять інформацію з обмеженим доступом), їх проекти",Управління містобудування та архітектури,https://opendata.kremen.gov.ua/dataset/%D0%B3%D0%B5%D0%BD%D0%B5%D1%80%D0%B0%D0%BB%D1%8C%D0%BD%D1%96-%D0%BF%D0%BB%D0%B0%D0%BD%D0%B8-%D0%BD%D0%B0%D1%81%D0%B5%D0%BB%D0%B5%D0%BD%D0%B8%D1%85-%D0%BF%D1%83%D0%BD%D0%BA%D1%82%D1%96%D0%B2-%D1%96%D1%81%D1%82%D0%BE%D1%80%D0%B8%D0%BA%D0%BE-%D0%B0%D1%80%D1%85%D1%96%D1%82%D0%B5%D0%BA%D1%82%D1%83%D1%80%D0%BD%D1%96-%D0%BE%D0%BF%D0%BE%D1%80%D0%BD%D1%96-%D0%BF%D0%BB%D0%B0%D0%BD%D0%B8-%D0%BF%D0%BB%D0%B0%D0%BD%D0%B8-%D0%B7%D0%BE%D0%BD%D1%83%D0%B2%D0%B0%D0%BD%D0%BD%D1%8F,https://data.gov.ua/dataset/ef75413b-522f-45b6-b4ea-a46581978e13
22,Дані про місцезнаходження громадського транспорту в режимі реального часу,Відділ транспорту,https://opendata.kremen.gov.ua/dataset/%D0%B4%D0%B0%D0%BD%D1%96-%D0%BF%D1%80%D0%BE-%D0%BC%D1%96%D1%81%D1%86%D0%B5%D0%B7%D0%BD%D0%B0%D1%85%D0%BE%D0%B4%D0%B6%D0%B5%D0%BD%D0%BD%D1%8F-%D0%B3%D1%80%D0%BE%D0%BC%D0%B0%D0%B4%D1%81%D1%8C%D0%BA%D0%BE%D0%B3%D0%BE-%D1%82%D1%80%D0%B0%D0%BD%D1%81%D0%BF%D0%BE%D1%80%D1%82%D1%83-%D0%B2-%D1%80%D0%B5%D0%B6%D0%B8%D0%BC%D1%96-%D1%80%D0%B5%D0%B0%D0%BB%D1%8C%D0%BD%D0%BE%D0%B3%D0%BE-%D1%87%D0%B0%D1%81%D1%83,https://data.gov.ua/dataset/e91bf398-def1-48b3-a984-e4d361b10574
23,Паспорти бюджетних програм місцевого бюджету,"Департамент фінансів, кожен окремо",https://opendata.kremen.gov.ua/dataset/%D0%BF%D0%B0%D1%81%D0%BF%D0%BE%D1%80%D1%82%D0%B8-%D0%B1%D1%8E%D0%B4%D0%B6%D0%B5%D1%82%D0%BD%D0%B8%D1%85-%D0%BF%D1%80%D0%BE%D0%B3%D1%80%D0%B0%D0%BC-%D0%BC%D1%96%D1%81%D1%86%D0%B5%D0%B2%D0%BE%D0%B3%D0%BE-%D0%B1%D1%8E%D0%B4%D0%B6%D0%B5%D1%82%D1%83-2,https://data.gov.ua/dataset/9ad780c3-b337-4019-a04c-bdf242cf9104
24,Звіти про виконання паспортів бюджетних програм місцевого бюджету,Управління бухгалтерського обліку та звітності,https://opendata.kremen.gov.ua/dataset/%D0%B7%D0%B2%D1%96%D1%82%D0%B8-%D0%BF%D1%80%D0%BE-%D0%B2%D0%B8%D0%BA%D0%BE%D0%BD%D0%B0%D0%BD%D0%BD%D1%8F-%D0%BF%D0%B0%D1%81%D0%BF%D0%BE%D1%80%D1%82%D1%96%D0%B2-%D0%B1%D1%8E%D0%B4%D0%B6%D0%B5%D1%82%D0%BD%D0%B8%D1%85-%D0%BF%D1%80%D0%BE%D0%B3%D1%80%D0%B0%D0%BC-%D0%BC%D1%96%D1%81%D1%86%D0%B5%D0%B2%D0%BE%D0%B3%D0%BE-%D0%B1%D1%8E%D0%B4%D0%B6%D0%B5%D1%82%D1%83-4,https://data.gov.ua/dataset/3c1b515d-aa6b-48ac-9aa8-409ac7161566
25,"Титульні списки на проведення капітального та поточного ремонту, будівництва, реконструкції та благоустрою",Департамент житлово-комунального господарства ,https://opendata.kremen.gov.ua/dataset/%D1%82%D0%B8%D1%82%D1%83%D0%BB%D1%8C%D0%BD%D0%B8%D0%B9-%D1%81%D0%BF%D0%B8%D1%81%D0%BE%D0%BA-%D0%BD%D0%B0-%D0%B2%D0%B8%D0%BA%D0%BE%D0%BD%D0%B0%D0%BD%D0%BD%D1%8F-%D1%80%D0%BE%D0%B1%D1%96%D1%82-%D0%B7-%D0%BD%D0%BE%D0%B2%D0%BE%D0%B3%D0%BE-%D0%B1%D1%83%D0%B4%D1%96%D0%B2%D0%BD%D0%B8%D1%86%D1%82%D0%B2%D0%B0-%D1%80%D0%B5%D0%BA%D0%BE%D0%BD%D1%81%D1%82%D1%80%D1%83%D0%BA%D1%86%D1%96%D1%97-%D1%82%D0%B0-%D1%82%D0%B5%D1%85%D0%BD%D1%96%D1%87%D0%BD%D0%BE%D0%B3%D0%BE,https://data.gov.ua/dataset/bc85af3a-8e6c-4e75-bb7b-de9d6ac0f576
26,"Інформація про рекламні засоби (дані про місце розміщення рекламного засобу, його вид і розміри, найменування розповсюджувача зовнішньої реклами, номер його телефону, дата видачі дозволу та строк його дії, номер і дата укладення договору, якщо місце розміщення рекламного засобу належить до комунальної власності)",Управління контролю за станом благоустрою/ Комунальне підприємство «Міськоформлення»,https://opendata.kremen.gov.ua/dataset/%D1%96%D0%BD%D1%84%D0%BE%D1%80%D0%BC%D0%B0%D1%86%D1%96%D1%8F-%D0%BF%D1%80%D0%BE-%D1%80%D0%B5%D0%BA%D0%BB%D0%B0%D0%BC%D0%BD%D1%96-%D0%B7%D0%B0%D1%81%D0%BE%D0%B1%D0%B8-1,https://data.gov.ua/dataset/74a358eb-0e2c-40f0-a634-3ad63b80b7d4
27,"Реєстр боргових зобов’язань суб’єктів господарювання комунальної власності територіальної громади (як суб’єктів господарювання перед третіми особами, так і третіх осіб - перед суб’єктами господарюваня)",Департамент фінансів,https://opendata.kremen.gov.ua/dataset/%D1%80%D0%B5%D1%94%D1%81%D1%82%D1%80-%D0%B1%D0%BE%D1%80%D0%B3%D0%BE%D0%B2%D0%B8%D1%85-%D0%B7%D0%BE%D0%B1%D0%BE%D0%B2%D1%8F%D0%B7%D0%B0%D0%BD%D1%8C-%D1%81%D1%83%D0%B1%D1%94%D0%BA%D1%82%D1%96%D0%B2-%D0%B3%D0%BE%D1%81%D0%BF%D0%BE%D0%B4%D0%B0%D1%80%D1%8E%D0%B2%D0%B0%D0%BD%D0%BD%D1%8F-%D0%BA%D0%BE%D0%BC%D1%83%D0%BD%D0%B0%D0%BB%D1%8C%D0%BD%D0%BE%D1%97-%D0%B2%D0%BB%D0%B0%D1%81%D0%BD%D0%BE%D1%81%D1%82%D1%96-%D1%82%D0%B5%D1%80%D0%B8%D1%82%D0%BE%D1%80%D1%96%D0%B0%D0%BB%D1%8C%D0%BD%D0%BE%D1%97,https://data.gov.ua/dataset/4d4d4c64-4397-4249-8b61-beca881bf216
28,"Перелік інвестиційних договорів, додатків, додаткових угод та інших матеріалів до них, умов, у тому числі посилань на оприлюднені ресурси в Інтернеті",Комунальне підприємство «Кременчуцький центр міжнародних зв'язків та економічного розвитку міста «Кременчук Інвест»,https://opendata.kremen.gov.ua/dataset/%D0%BF%D0%B5%D1%80%D0%B5%D0%BB%D1%96%D0%BA-%D1%96%D0%BD%D0%B2%D0%B5%D1%81%D1%82%D0%B8%D1%86%D1%96%D0%B9%D0%BD%D0%B8%D1%85-%D0%B4%D0%BE%D0%B3%D0%BE%D0%B2%D0%BE%D1%80%D1%96%D0%B2-%D0%B4%D0%BE%D0%B4%D0%B0%D1%82%D0%BA%D1%96%D0%B2-%D0%B4%D0%BE%D0%B4%D0%B0%D1%82%D0%BA%D0%BE%D0%B2%D0%B8%D1%85-%D1%83%D0%B3%D0%BE%D0%B4-%D1%82%D0%B0-%D1%96%D0%BD%D1%88%D0%B8%D1%85-%D0%BC%D0%B0%D1%82%D0%B5%D1%80%D1%96%D0%B0%D0%BB%D1%96%D0%B2-%D0%B4%D0%BE-%D0%BD%D0%B8%D1%85-%D1%83%D0%BC%D0%BE%D0%B2-%D1%83-4,https://data.gov.ua/dataset/587c8441-3e15-4c3f-810f-d53c4f5d0e23 
29,"Дані про об’єкти та засоби торгівлі (пересувна, сезонна та інші)","Управління розвитку підприємництва, торгівлі, побуту та регуляторної політики / Архітектура",https://opendata.kremen.gov.ua/dataset/%D0%B4%D0%B0%D0%BD%D1%96-%D0%BF%D1%80%D0%BE-%D0%BE%D0%B1%E2%80%99%D1%94%D0%BA%D1%82%D0%B8-%D1%82%D0%B0-%D0%B7%D0%B0%D1%81%D0%BE%D0%B1%D0%B8-%D1%82%D0%BE%D1%80%D0%B3%D1%96%D0%B2%D0%BB%D1%96-%D0%BF%D0%B5%D1%80%D0%B5%D1%81%D1%83%D0%B2%D0%BD%D0%B0-%D1%81%D0%B5%D0%B7%D0%BE%D0%BD%D0%BD%D0%B0-%D1%82%D0%B0-%D1%96%D0%BD%D1%88%D1%96 ,https://data.gov.ua/dataset/cb2b69e0-11cf-4d8e-afce-bcd2145d60d6
30,Відомості щодо схем розміщення засобів сезонної торгівлі,"Управління розвитку підприємництва, торгівлі, побуту та регуляторної політики",https://opendata.kremen.gov.ua/dataset/%D0%B2%D1%96%D0%B4%D0%BE%D0%BC%D0%BE%D1%81%D1%82%D1%96-%D0%BF%D1%80%D0%BE-%D1%81%D1%85%D0%B5%D0%BC%D0%B8-%D1%80%D0%BE%D0%B7%D0%BC%D1%96%D1%89%D0%B5%D0%BD%D0%BD%D1%8F-%D0%B7%D0%B0%D1%81%D0%BE%D0%B1%D1%96%D0%B2-%D1%81%D0%B5%D0%B7%D0%BE%D0%BD%D0%BD%D0%BE%D1%97-%D1%82%D0%BE%D1%80%D0%B3%D1%96%D0%B2%D0%BB%D1%96,https://data.gov.ua/dataset/e0876eb7-8c6d-4f6d-916e-08e99c4fa897
